{
  "schema_version": 1,
  "base_image": "debian:13-slim@sha256:d7e12182ce18b85b93007c1dedf31f2d29e01ccf3182cc4017c709b6259bc132",
  "debian_snapshot": "20260901T000000Z",
  "apt_packages": [
    "ca-certificates",
    "fontconfig",
    "git",
    "pandoc",
    "python3",
    "python3-pip",
    "python3-venv",
    "texlive-bibtex-extra",
    "texlive-fonts-recommended",
    "texlive-latex-extra",
    "texlive-luatex"
  ],
  "apt_package_versions": {
    "ca-certificates": "20250419",
    "fontconfig": "2.15.0-2.3",
    "git": "1:2.47.3-0+deb13u1",
    "pandoc": "3.1.11.1+ds-2",
    "python3": "3.13.5-1",
    "python3-pip": "25.1.1+dfsg-1",
    "python3-venv": "3.13.5-1",
    "texlive-bibtex-extra": "2024.20250309-2",
    "texlive-fonts-recommended": "2024.20250309-1",
    "texlive-latex-extra": "2024.20250309-2",
    "texlive-luatex": "2024.20250309-1"
  },
  "python_version": "3.13.5",
  "python_packages": {
    "jsonschema": "4.25.1",
    "matplotlib": "3.10.6",
    "numpy": "2.3.3",
    "pandas": "2.3.2",
    "PyMuPDF": "1.28.2",
    "pytest": "8.3.4"
  },
  "python_lock_sha256": "2634cf36c3b193f2d9a026b023eda41bd2f013a508662f0a23bcafe5a3239c08",
  "fonts": {
    "font_data/GoogleSans-Bold.ttf": "a0936e8e2b28f990fd0472c07a8db9128a874b40e79e87853585f08c8106f114",
    "font_data/GoogleSans-Medium.ttf": "4de69940330e5783c678b94809c68b44f1e4af544ae7d7638d3c659b83895867",
    "font_data/GoogleSans-Regular.ttf": "9bbea74c7b2717525b76f0631ca03574cf672030c64f3961e8d54bfe0bc4b68a",
    "font_data/reportkit-libertinus-fonts.tar.gz": "3f02be1a2c269af8c5ea95b2b93a8337e8cc1147f17f8f607923e189939fa7c9"
  },
  "renderer": {
    "dpi": 150,
    "pixel_difference_threshold": 0.01
  },
  "normalization": {
    "matplotlib_backend": "Agg",
    "source_date_epoch": 1,
    "timezone": "UTC"
  }
}
